{"$schema":"https://json-schema.org/draft/2020-12/schema","$id":"https://oresoftware.com/contracts/server-filesystem-routing/web-v1.schema.json","type":"object","additionalProperties":false,"required":["schema_version","server_kind","page_root","files","url","layouts","generation"],"properties":{"schema_version":{"const":"ores.server-filesystem-routing.v1"},"server_kind":{"enum":["web","admin_web"]},"page_root":{"const":"src/pages"},"files":{"type":"object","additionalProperties":false,"required":["authored_required","authored_optional","generated"],"properties":{"authored_required":{"const":["page.rs"]},"authored_optional":{"const":["gen.rs","layout.rs"]},"generated":{"const":["lambda.rs"]}}},"url":{"type":"object","additionalProperties":false,"required":["static_segment","dynamic_segment","catch_all_segment","optional_catch_all_segment","parameter_name_charset","duplicate_parameter_names","catch_all_must_be_final","hidden_route_groups","one_to_one_url_mapping"],"properties":{"static_segment":{"const":"literal-directory-name"},"dynamic_segment":{"const":"[name]"},"catch_all_segment":{"const":"[...name]"},"optional_catch_all_segment":{"const":"[[...name]]"},"parameter_name_charset":{"const":"ascii_alnum_underscore_hyphen"},"duplicate_parameter_names":{"const":false},"catch_all_must_be_final":{"const":true},"hidden_route_groups":{"const":false},"one_to_one_url_mapping":{"const":true}}},"layouts":{"type":"object","additionalProperties":false,"required":["file","abi","scope","discovery_order","application_order","root_layout_is_outermost","changes_url","runtime_filesystem_walk"],"properties":{"file":{"const":"layout.rs"},"abi":{"const":"PageLayoutFn(PageContext,PageDocument)->PageLayoutFuture"},"scope":{"const":"ancestor_directories_under_src_pages"},"discovery_order":{"const":"root_to_leaf"},"application_order":{"const":"leaf_to_root"},"root_layout_is_outermost":{"const":true},"changes_url":{"const":false},"runtime_filesystem_walk":{"const":false}}},"generation":{"type":"object","additionalProperties":false,"required":["orchestrator","lambda_codegen_owner","lambda_source_authority","lambda_generated_marker","provider_neutral_lambda","standalone_and_lambda_share_page_entry","rpc_generated"],"properties":{"orchestrator":{"const":"ores-stack"},"lambda_codegen_owner":{"const":"ores-api-docs"},"lambda_source_authority":{"const":"page.rs"},"lambda_generated_marker":{"const":"// @generated by ores-api-docs for a *-web-server.rs page; DO NOT EDIT."},"provider_neutral_lambda":{"const":true},"standalone_and_lambda_share_page_entry":{"const":true},"rpc_generated":{"const":false}}}}}
